Sheet: Sheet1
A1: 360k | B1: Head 0 | K1: Head 1
B2: Trk 1 | C2: Trk 2 | D2: Trk 3 | E2: Trk 4 | F2: Trk 5 | G2: Trk 6 | H2: Trk 7 | I2: Trk 8 | J2: Trk 9 | K2: Trk 1 | L2: Trk 2 | M2: Trk 3 | N2: Trk 4 | O2: Trk 5 | P2: Trk 6 | Q2: Trk 7 | R2: Trk 8 | S2: Trk 9
A3: Cyl 0 | B3: 0 | C3: 1 | D3: 2 | E3: 3 | F3: 4 | G3: 5 | H3: 6 | I3: 7 | J3: 8 | K3: 9 | L3: 10 | M3: 11 | N3: 12 | O3: 13 | P3: 14 | Q3: 15 | R3: 16 | S3: 17 | U3: Stage 1
A4: Cyl 1 | B4: 18 | C4: 19 | D4: 20 | E4: 21 | F4: 22 | G4: 23 | H4: 24 | I4: 25 | J4: 26 | K4: 27 | L4: 28 | M4: 29 | N4: 30 | O4: 31 | P4: 32 | Q4: 33 | R4: 17 | S4: 35 | U4: Stage 2
A5: Cyl 2 | B5: 36 | C5: 37 | D5: 38 | E5: 39 | F5: 40 | G5: 41 | H5: 42 | I5: 43 | J5: 44 | K5: 45 | L5: 46 | M5: 47 | N5: 48 | O5: 49 | P5: 50 | Q5: 51 | R5: 52 | S5: 53 | U5: Main Executive
A6: Cyl 3 | B6: of:=[.B5]+18 -> 54 | C6: of:=[.C5]+18 -> 55 | D6: of:=[.D5]+18 -> 56 | E6: of:=[.E5]+18 -> 57 | F6: of:=[.F5]+18 -> 58 | G6: of:=[.G5]+18 -> 59 | H6: of:=[.H5]+18 -> 60 | I6: of:=[.I5]+18 -> 61 | J6: of:=[.J5]+18 -> 62 | K6: of:=[.K5]+18 -> 63 | L6: of:=[.L5]+18 -> 64 | M6: of:=[.M5]+18 -> 65 | N6: of:=[.N5]+18 -> 66 | O6: of:=[.O5]+18 -> 67 | P6: of:=[.P5]+18 -> 68 | Q6: of:=[.Q5]+18 -> 69 | R6: of:=[.R5]+18 -> 70 | S6: of:=[.S5]+18 -> 71 | U6: File0 | V6: Splash Screen
A7: Cyl 4 | B7: of:=[.B6]+18 -> 72 | C7: of:=[.C6]+18 -> 73 | D7: of:=[.D6]+18 -> 74 | E7: of:=[.E6]+18 -> 75 | F7: of:=[.F6]+18 -> 76 | G7: of:=[.G6]+18 -> 77 | H7: of:=[.H6]+18 -> 78 | I7: of:=[.I6]+18 -> 79 | J7: of:=[.J6]+18 -> 80 | K7: of:=[.K6]+18 -> 81 | L7: of:=[.L6]+18 -> 82 | M7: of:=[.M6]+18 -> 83 | N7: of:=[.N6]+18 -> 84 | O7: of:=[.O6]+18 -> 85 | P7: of:=[.P6]+18 -> 86 | Q7: of:=[.Q6]+18 -> 87 | R7: of:=[.R6]+18 -> 88 | S7: of:=[.S6]+18 -> 89 | U7: File1
A8: Cyl 5 | B8: of:=[.B7]+18 -> 90 | C8: of:=[.C7]+18 -> 91 | D8: of:=[.D7]+18 -> 92 | E8: of:=[.E7]+18 -> 93 | F8: of:=[.F7]+18 -> 94 | G8: of:=[.G7]+18 -> 95 | H8: of:=[.H7]+18 -> 96 | I8: of:=[.I7]+18 -> 97 | J8: of:=[.J7]+18 -> 98 | K8: of:=[.K7]+18 -> 99 | L8: of:=[.L7]+18 -> 100 | M8: of:=[.M7]+18 -> 101 | N8: of:=[.N7]+18 -> 102 | O8: of:=[.O7]+18 -> 103 | P8: of:=[.P7]+18 -> 104 | Q8: of:=[.Q7]+18 -> 105 | R8: of:=[.R7]+18 -> 106 | S8: of:=[.S7]+18 -> 107 | U8: File2
A9: Cyl 6 | B9: of:=[.B8]+18 -> 108 | C9: of:=[.C8]+18 -> 109 | D9: of:=[.D8]+18 -> 110 | E9: of:=[.E8]+18 -> 111 | F9: of:=[.F8]+18 -> 112 | G9: of:=[.G8]+18 -> 113 | H9: of:=[.H8]+18 -> 114 | I9: of:=[.I8]+18 -> 115 | J9: of:=[.J8]+18 -> 116 | K9: of:=[.K8]+18 -> 117 | L9: of:=[.L8]+18 -> 118 | M9: of:=[.M8]+18 -> 119 | N9: of:=[.N8]+18 -> 120 | O9: of:=[.O8]+18 -> 121 | P9: of:=[.P8]+18 -> 122 | Q9: of:=[.Q8]+18 -> 123 | R9: of:=[.R8]+18 -> 124 | S9: of:=[.S8]+18 -> 125 | U9: File3
A10: Cyl 7 | B10: of:=[.B9]+18 -> 126 | C10: of:=[.C9]+18 -> 127 | D10: of:=[.D9]+18 -> 128 | E10: of:=[.E9]+18 -> 129 | F10: of:=[.F9]+18 -> 130 | G10: of:=[.G9]+18 -> 131 | H10: of:=[.H9]+18 -> 132 | I10: of:=[.I9]+18 -> 133 | J10: of:=[.J9]+18 -> 134 | K10: of:=[.K9]+18 -> 135 | L10: of:=[.L9]+18 -> 136 | M10: of:=[.M9]+18 -> 137 | N10: of:=[.N9]+18 -> 138 | O10: of:=[.O9]+18 -> 139 | P10: of:=[.P9]+18 -> 140 | Q10: of:=[.Q9]+18 -> 141 | R10: of:=[.R9]+18 -> 142 | S10: of:=[.S9]+18 -> 143 | U10: File4
A11: Cyl 8 | B11: of:=[.B10]+18 -> 144 | C11: of:=[.C10]+18 -> 145 | D11: of:=[.D10]+18 -> 146 | E11: of:=[.E10]+18 -> 147 | F11: of:=[.F10]+18 -> 148 | G11: of:=[.G10]+18 -> 149 | H11: of:=[.H10]+18 -> 150 | I11: of:=[.I10]+18 -> 151 | J11: of:=[.J10]+18 -> 152 | K11: of:=[.K10]+18 -> 153 | L11: of:=[.L10]+18 -> 154 | M11: of:=[.M10]+18 -> 155 | N11: of:=[.N10]+18 -> 156 | O11: of:=[.O10]+18 -> 157 | P11: of:=[.P10]+18 -> 158 | Q11: of:=[.Q10]+18 -> 159 | R11: of:=[.R10]+18 -> 160 | S11: of:=[.S10]+18 -> 161
A12: Cyl 9 | B12: of:=[.B11]+18 -> 162 | C12: of:=[.C11]+18 -> 163 | D12: of:=[.D11]+18 -> 164 | E12: of:=[.E11]+18 -> 165 | F12: of:=[.F11]+18 -> 166 | G12: of:=[.G11]+18 -> 167 | H12: of:=[.H11]+18 -> 168 | I12: of:=[.I11]+18 -> 169 | J12: of:=[.J11]+18 -> 170 | K12: of:=[.K11]+18 -> 171 | L12: of:=[.L11]+18 -> 172 | M12: of:=[.M11]+18 -> 173 | N12: of:=[.N11]+18 -> 174 | O12: of:=[.O11]+18 -> 175 | P12: of:=[.P11]+18 -> 176 | Q12: of:=[.Q11]+18 -> 177 | R12: of:=[.R11]+18 -> 178 | S12: of:=[.S11]+18 -> 179
A13: Cyl 10 | B13: of:=[.B12]+18 -> 180 | C13: of:=[.C12]+18 -> 181 | D13: of:=[.D12]+18 -> 182 | E13: of:=[.E12]+18 -> 183 | F13: of:=[.F12]+18 -> 184 | G13: of:=[.G12]+18 -> 185 | H13: of:=[.H12]+18 -> 186 | I13: of:=[.I12]+18 -> 187 | J13: of:=[.J12]+18 -> 188 | K13: of:=[.K12]+18 -> 189 | L13: of:=[.L12]+18 -> 190 | M13: of:=[.M12]+18 -> 191 | N13: of:=[.N12]+18 -> 192 | O13: of:=[.O12]+18 -> 193 | P13: of:=[.P12]+18 -> 194 | Q13: of:=[.Q12]+18 -> 195 | R13: of:=[.R12]+18 -> 196 | S13: of:=[.S12]+18 -> 197
A14: Cyl 11 | B14: of:=[.B13]+18 -> 198 | C14: of:=[.C13]+18 -> 199 | D14: of:=[.D13]+18 -> 200 | E14: of:=[.E13]+18 -> 201 | F14: of:=[.F13]+18 -> 202 | G14: of:=[.G13]+18 -> 203 | H14: of:=[.H13]+18 -> 204 | I14: of:=[.I13]+18 -> 205 | J14: of:=[.J13]+18 -> 206 | K14: of:=[.K13]+18 -> 207 | L14: of:=[.L13]+18 -> 208 | M14: of:=[.M13]+18 -> 209 | N14: of:=[.N13]+18 -> 210 | O14: of:=[.O13]+18 -> 211 | P14: of:=[.P13]+18 -> 212 | Q14: of:=[.Q13]+18 -> 213 | R14: of:=[.R13]+18 -> 214 | S14: of:=[.S13]+18 -> 215
A15: Cyl 12 | B15: of:=[.B14]+18 -> 216 | C15: of:=[.C14]+18 -> 217 | D15: of:=[.D14]+18 -> 218 | E15: of:=[.E14]+18 -> 219 | F15: of:=[.F14]+18 -> 220 | G15: of:=[.G14]+18 -> 221 | H15: of:=[.H14]+18 -> 222 | I15: of:=[.I14]+18 -> 223 | J15: of:=[.J14]+18 -> 224 | K15: of:=[.K14]+18 -> 225 | L15: of:=[.L14]+18 -> 226 | M15: of:=[.M14]+18 -> 227 | N15: of:=[.N14]+18 -> 228 | O15: of:=[.O14]+18 -> 229 | P15: of:=[.P14]+18 -> 230 | Q15: of:=[.Q14]+18 -> 231 | R15: of:=[.R14]+18 -> 232 | S15: of:=[.S14]+18 -> 233
A16: Cyl 13 | B16: of:=[.B15]+18 -> 234 | C16: of:=[.C15]+18 -> 235 | D16: of:=[.D15]+18 -> 236 | E16: of:=[.E15]+18 -> 237 | F16: of:=[.F15]+18 -> 238 | G16: of:=[.G15]+18 -> 239 | H16: of:=[.H15]+18 -> 240 | I16: of:=[.I15]+18 -> 241 | J16: of:=[.J15]+18 -> 242 | K16: of:=[.K15]+18 -> 243 | L16: of:=[.L15]+18 -> 244 | M16: of:=[.M15]+18 -> 245 | N16: of:=[.N15]+18 -> 246 | O16: of:=[.O15]+18 -> 247 | P16: of:=[.P15]+18 -> 248 | Q16: of:=[.Q15]+18 -> 249 | R16: of:=[.R15]+18 -> 250 | S16: of:=[.S15]+18 -> 251
A17: Cyl 14 | B17: of:=[.B16]+18 -> 252 | C17: of:=[.C16]+18 -> 253 | D17: of:=[.D16]+18 -> 254 | E17: of:=[.E16]+18 -> 255 | F17: of:=[.F16]+18 -> 256 | G17: of:=[.G16]+18 -> 257 | H17: of:=[.H16]+18 -> 258 | I17: of:=[.I16]+18 -> 259 | J17: of:=[.J16]+18 -> 260 | K17: of:=[.K16]+18 -> 261 | L17: of:=[.L16]+18 -> 262 | M17: of:=[.M16]+18 -> 263 | N17: of:=[.N16]+18 -> 264 | O17: of:=[.O16]+18 -> 265 | P17: of:=[.P16]+18 -> 266 | Q17: of:=[.Q16]+18 -> 267 | R17: of:=[.R16]+18 -> 268 | S17: of:=[.S16]+18 -> 269
A18: Cyl 15 | B18: of:=[.B17]+18 -> 270 | C18: of:=[.C17]+18 -> 271 | D18: of:=[.D17]+18 -> 272 | E18: of:=[.E17]+18 -> 273 | F18: of:=[.F17]+18 -> 274 | G18: of:=[.G17]+18 -> 275 | H18: of:=[.H17]+18 -> 276 | I18: of:=[.I17]+18 -> 277 | J18: of:=[.J17]+18 -> 278 | K18: of:=[.K17]+18 -> 279 | L18: of:=[.L17]+18 -> 280 | M18: of:=[.M17]+18 -> 281 | N18: of:=[.N17]+18 -> 282 | O18: of:=[.O17]+18 -> 283 | P18: of:=[.P17]+18 -> 284 | Q18: of:=[.Q17]+18 -> 285 | R18: of:=[.R17]+18 -> 286 | S18: of:=[.S17]+18 -> 287
A19: Cyl 16 | B19: of:=[.B18]+18 -> 288 | C19: of:=[.C18]+18 -> 289 | D19: of:=[.D18]+18 -> 290 | E19: of:=[.E18]+18 -> 291 | F19: of:=[.F18]+18 -> 292 | G19: of:=[.G18]+18 -> 293 | H19: of:=[.H18]+18 -> 294 | I19: of:=[.I18]+18 -> 295 | J19: of:=[.J18]+18 -> 296 | K19: of:=[.K18]+18 -> 297 | L19: of:=[.L18]+18 -> 298 | M19: of:=[.M18]+18 -> 299 | N19: of:=[.N18]+18 -> 300 | O19: of:=[.O18]+18 -> 301 | P19: of:=[.P18]+18 -> 302 | Q19: of:=[.Q18]+18 -> 303 | R19: of:=[.R18]+18 -> 304 | S19: of:=[.S18]+18 -> 305
A20: Cyl 17 | B20: of:=[.B19]+18 -> 306 | C20: of:=[.C19]+18 -> 307 | D20: of:=[.D19]+18 -> 308 | E20: of:=[.E19]+18 -> 309 | F20: of:=[.F19]+18 -> 310 | G20: of:=[.G19]+18 -> 311 | H20: of:=[.H19]+18 -> 312 | I20: of:=[.I19]+18 -> 313 | J20: of:=[.J19]+18 -> 314 | K20: of:=[.K19]+18 -> 315 | L20: of:=[.L19]+18 -> 316 | M20: of:=[.M19]+18 -> 317 | N20: of:=[.N19]+18 -> 318 | O20: of:=[.O19]+18 -> 319 | P20: of:=[.P19]+18 -> 320 | Q20: of:=[.Q19]+18 -> 321 | R20: of:=[.R19]+18 -> 322 | S20: of:=[.S19]+18 -> 323
A21: Cyl 18 | B21: of:=[.B20]+18 -> 324 | C21: of:=[.C20]+18 -> 325 | D21: of:=[.D20]+18 -> 326 | E21: of:=[.E20]+18 -> 327 | F21: of:=[.F20]+18 -> 328 | G21: of:=[.G20]+18 -> 329 | H21: of:=[.H20]+18 -> 330 | I21: of:=[.I20]+18 -> 331 | J21: of:=[.J20]+18 -> 332 | K21: of:=[.K20]+18 -> 333 | L21: of:=[.L20]+18 -> 334 | M21: of:=[.M20]+18 -> 335 | N21: of:=[.N20]+18 -> 336 | O21: of:=[.O20]+18 -> 337 | P21: of:=[.P20]+18 -> 338 | Q21: of:=[.Q20]+18 -> 339 | R21: of:=[.R20]+18 -> 340 | S21: of:=[.S20]+18 -> 341
A22: Cyl 19 | B22: of:=[.B21]+18 -> 342 | C22: of:=[.C21]+18 -> 343 | D22: of:=[.D21]+18 -> 344 | E22: of:=[.E21]+18 -> 345 | F22: of:=[.F21]+18 -> 346 | G22: of:=[.G21]+18 -> 347 | H22: of:=[.H21]+18 -> 348 | I22: of:=[.I21]+18 -> 349 | J22: of:=[.J21]+18 -> 350 | K22: of:=[.K21]+18 -> 351 | L22: of:=[.L21]+18 -> 352 | M22: of:=[.M21]+18 -> 353 | N22: of:=[.N21]+18 -> 354 | O22: of:=[.O21]+18 -> 355 | P22: of:=[.P21]+18 -> 356 | Q22: of:=[.Q21]+18 -> 357 | R22: of:=[.R21]+18 -> 358 | S22: of:=[.S21]+18 -> 359
A23: Cyl 20 | B23: of:=[.B22]+18 -> 360 | C23: of:=[.C22]+18 -> 361 | D23: of:=[.D22]+18 -> 362 | E23: of:=[.E22]+18 -> 363 | F23: of:=[.F22]+18 -> 364 | G23: of:=[.G22]+18 -> 365 | H23: of:=[.H22]+18 -> 366 | I23: of:=[.I22]+18 -> 367 | J23: of:=[.J22]+18 -> 368 | K23: of:=[.K22]+18 -> 369 | L23: of:=[.L22]+18 -> 370 | M23: of:=[.M22]+18 -> 371 | N23: of:=[.N22]+18 -> 372 | O23: of:=[.O22]+18 -> 373 | P23: of:=[.P22]+18 -> 374 | Q23: of:=[.Q22]+18 -> 375 | R23: of:=[.R22]+18 -> 376 | S23: of:=[.S22]+18 -> 377
A24: Cyl 21 | B24: of:=[.B23]+18 -> 378 | C24: of:=[.C23]+18 -> 379 | D24: of:=[.D23]+18 -> 380 | E24: of:=[.E23]+18 -> 381 | F24: of:=[.F23]+18 -> 382 | G24: of:=[.G23]+18 -> 383 | H24: of:=[.H23]+18 -> 384 | I24: of:=[.I23]+18 -> 385 | J24: of:=[.J23]+18 -> 386 | K24: of:=[.K23]+18 -> 387 | L24: of:=[.L23]+18 -> 388 | M24: of:=[.M23]+18 -> 389 | N24: of:=[.N23]+18 -> 390 | O24: of:=[.O23]+18 -> 391 | P24: of:=[.P23]+18 -> 392 | Q24: of:=[.Q23]+18 -> 393 | R24: of:=[.R23]+18 -> 394 | S24: of:=[.S23]+18 -> 395
A25: Cyl 22 | B25: of:=[.B24]+18 -> 396 | C25: of:=[.C24]+18 -> 397 | D25: of:=[.D24]+18 -> 398 | E25: of:=[.E24]+18 -> 399 | F25: of:=[.F24]+18 -> 400 | G25: of:=[.G24]+18 -> 401 | H25: of:=[.H24]+18 -> 402 | I25: of:=[.I24]+18 -> 403 | J25: of:=[.J24]+18 -> 404 | K25: of:=[.K24]+18 -> 405 | L25: of:=[.L24]+18 -> 406 | M25: of:=[.M24]+18 -> 407 | N25: of:=[.N24]+18 -> 408 | O25: of:=[.O24]+18 -> 409 | P25: of:=[.P24]+18 -> 410 | Q25: of:=[.Q24]+18 -> 411 | R25: of:=[.R24]+18 -> 412 | S25: of:=[.S24]+18 -> 413
A26: Cyl 23 | B26: of:=[.B25]+18 -> 414 | C26: of:=[.C25]+18 -> 415 | D26: of:=[.D25]+18 -> 416 | E26: of:=[.E25]+18 -> 417 | F26: of:=[.F25]+18 -> 418 | G26: of:=[.G25]+18 -> 419 | H26: of:=[.H25]+18 -> 420 | I26: of:=[.I25]+18 -> 421 | J26: of:=[.J25]+18 -> 422 | K26: of:=[.K25]+18 -> 423 | L26: of:=[.L25]+18 -> 424 | M26: of:=[.M25]+18 -> 425 | N26: of:=[.N25]+18 -> 426 | O26: of:=[.O25]+18 -> 427 | P26: of:=[.P25]+18 -> 428 | Q26: of:=[.Q25]+18 -> 429 | R26: of:=[.R25]+18 -> 430 | S26: of:=[.S25]+18 -> 431
A27: Cyl 24 | B27: of:=[.B26]+18 -> 432 | C27: of:=[.C26]+18 -> 433 | D27: of:=[.D26]+18 -> 434 | E27: of:=[.E26]+18 -> 435 | F27: of:=[.F26]+18 -> 436 | G27: of:=[.G26]+18 -> 437 | H27: of:=[.H26]+18 -> 438 | I27: of:=[.I26]+18 -> 439 | J27: of:=[.J26]+18 -> 440 | K27: of:=[.K26]+18 -> 441 | L27: of:=[.L26]+18 -> 442 | M27: of:=[.M26]+18 -> 443 | N27: of:=[.N26]+18 -> 444 | O27: of:=[.O26]+18 -> 445 | P27: of:=[.P26]+18 -> 446 | Q27: of:=[.Q26]+18 -> 447 | R27: of:=[.R26]+18 -> 448 | S27: of:=[.S26]+18 -> 449
A28: Cyl 25 | B28: of:=[.B27]+18 -> 450 | C28: of:=[.C27]+18 -> 451 | D28: of:=[.D27]+18 -> 452 | E28: of:=[.E27]+18 -> 453 | F28: of:=[.F27]+18 -> 454 | G28: of:=[.G27]+18 -> 455 | H28: of:=[.H27]+18 -> 456 | I28: of:=[.I27]+18 -> 457 | J28: of:=[.J27]+18 -> 458 | K28: of:=[.K27]+18 -> 459 | L28: of:=[.L27]+18 -> 460 | M28: of:=[.M27]+18 -> 461 | N28: of:=[.N27]+18 -> 462 | O28: of:=[.O27]+18 -> 463 | P28: of:=[.P27]+18 -> 464 | Q28: of:=[.Q27]+18 -> 465 | R28: of:=[.R27]+18 -> 466 | S28: of:=[.S27]+18 -> 467
A29: Cyl 26 | B29: of:=[.B28]+18 -> 468 | C29: of:=[.C28]+18 -> 469 | D29: of:=[.D28]+18 -> 470 | E29: of:=[.E28]+18 -> 471 | F29: of:=[.F28]+18 -> 472 | G29: of:=[.G28]+18 -> 473 | H29: of:=[.H28]+18 -> 474 | I29: of:=[.I28]+18 -> 475 | J29: of:=[.J28]+18 -> 476 | K29: of:=[.K28]+18 -> 477 | L29: of:=[.L28]+18 -> 478 | M29: of:=[.M28]+18 -> 479 | N29: of:=[.N28]+18 -> 480 | O29: of:=[.O28]+18 -> 481 | P29: of:=[.P28]+18 -> 482 | Q29: of:=[.Q28]+18 -> 483 | R29: of:=[.R28]+18 -> 484 | S29: of:=[.S28]+18 -> 485
A30: Cyl 27 | B30: of:=[.B29]+18 -> 486 | C30: of:=[.C29]+18 -> 487 | D30: of:=[.D29]+18 -> 488 | E30: of:=[.E29]+18 -> 489 | F30: of:=[.F29]+18 -> 490 | G30: of:=[.G29]+18 -> 491 | H30: of:=[.H29]+18 -> 492 | I30: of:=[.I29]+18 -> 493 | J30: of:=[.J29]+18 -> 494 | K30: of:=[.K29]+18 -> 495 | L30: of:=[.L29]+18 -> 496 | M30: of:=[.M29]+18 -> 497 | N30: of:=[.N29]+18 -> 498 | O30: of:=[.O29]+18 -> 499 | P30: of:=[.P29]+18 -> 500 | Q30: of:=[.Q29]+18 -> 501 | R30: of:=[.R29]+18 -> 502 | S30: of:=[.S29]+18 -> 503
A31: Cyl 28 | B31: of:=[.B30]+18 -> 504 | C31: of:=[.C30]+18 -> 505 | D31: of:=[.D30]+18 -> 506 | E31: of:=[.E30]+18 -> 507 | F31: of:=[.F30]+18 -> 508 | G31: of:=[.G30]+18 -> 509 | H31: of:=[.H30]+18 -> 510 | I31: of:=[.I30]+18 -> 511 | J31: of:=[.J30]+18 -> 512 | K31: of:=[.K30]+18 -> 513 | L31: of:=[.L30]+18 -> 514 | M31: of:=[.M30]+18 -> 515 | N31: of:=[.N30]+18 -> 516 | O31: of:=[.O30]+18 -> 517 | P31: of:=[.P30]+18 -> 518 | Q31: of:=[.Q30]+18 -> 519 | R31: of:=[.R30]+18 -> 520 | S31: of:=[.S30]+18 -> 521
A32: Cyl 29 | B32: of:=[.B31]+18 -> 522 | C32: of:=[.C31]+18 -> 523 | D32: of:=[.D31]+18 -> 524 | E32: of:=[.E31]+18 -> 525 | F32: of:=[.F31]+18 -> 526 | G32: of:=[.G31]+18 -> 527 | H32: of:=[.H31]+18 -> 528 | I32: of:=[.I31]+18 -> 529 | J32: of:=[.J31]+18 -> 530 | K32: of:=[.K31]+18 -> 531 | L32: of:=[.L31]+18 -> 532 | M32: of:=[.M31]+18 -> 533 | N32: of:=[.N31]+18 -> 534 | O32: of:=[.O31]+18 -> 535 | P32: of:=[.P31]+18 -> 536 | Q32: of:=[.Q31]+18 -> 537 | R32: of:=[.R31]+18 -> 538 | S32: of:=[.S31]+18 -> 539
A33: Cyl 30 | B33: of:=[.B32]+18 -> 540 | C33: of:=[.C32]+18 -> 541 | D33: of:=[.D32]+18 -> 542 | E33: of:=[.E32]+18 -> 543 | F33: of:=[.F32]+18 -> 544 | G33: of:=[.G32]+18 -> 545 | H33: of:=[.H32]+18 -> 546 | I33: of:=[.I32]+18 -> 547 | J33: of:=[.J32]+18 -> 548 | K33: of:=[.K32]+18 -> 549 | L33: of:=[.L32]+18 -> 550 | M33: of:=[.M32]+18 -> 551 | N33: of:=[.N32]+18 -> 552 | O33: of:=[.O32]+18 -> 553 | P33: of:=[.P32]+18 -> 554 | Q33: of:=[.Q32]+18 -> 555 | R33: of:=[.R32]+18 -> 556 | S33: of:=[.S32]+18 -> 557
A34: Cyl 31 | B34: of:=[.B33]+18 -> 558 | C34: of:=[.C33]+18 -> 559 | D34: of:=[.D33]+18 -> 560 | E34: of:=[.E33]+18 -> 561 | F34: of:=[.F33]+18 -> 562 | G34: of:=[.G33]+18 -> 563 | H34: of:=[.H33]+18 -> 564 | I34: of:=[.I33]+18 -> 565 | J34: of:=[.J33]+18 -> 566 | K34: of:=[.K33]+18 -> 567 | L34: of:=[.L33]+18 -> 568 | M34: of:=[.M33]+18 -> 569 | N34: of:=[.N33]+18 -> 570 | O34: of:=[.O33]+18 -> 571 | P34: of:=[.P33]+18 -> 572 | Q34: of:=[.Q33]+18 -> 573 | R34: of:=[.R33]+18 -> 574 | S34: of:=[.S33]+18 -> 575
A35: Cyl 32 | B35: of:=[.B34]+18 -> 576 | C35: of:=[.C34]+18 -> 577 | D35: of:=[.D34]+18 -> 578 | E35: of:=[.E34]+18 -> 579 | F35: of:=[.F34]+18 -> 580 | G35: of:=[.G34]+18 -> 581 | H35: of:=[.H34]+18 -> 582 | I35: of:=[.I34]+18 -> 583 | J35: of:=[.J34]+18 -> 584 | K35: of:=[.K34]+18 -> 585 | L35: of:=[.L34]+18 -> 586 | M35: of:=[.M34]+18 -> 587 | N35: of:=[.N34]+18 -> 588 | O35: of:=[.O34]+18 -> 589 | P35: of:=[.P34]+18 -> 590 | Q35: of:=[.Q34]+18 -> 591 | R35: of:=[.R34]+18 -> 592 | S35: of:=[.S34]+18 -> 593
A36: Cyl 33 | B36: of:=[.B35]+18 -> 594 | C36: of:=[.C35]+18 -> 595 | D36: of:=[.D35]+18 -> 596 | E36: of:=[.E35]+18 -> 597 | F36: of:=[.F35]+18 -> 598 | G36: of:=[.G35]+18 -> 599 | H36: of:=[.H35]+18 -> 600 | I36: of:=[.I35]+18 -> 601 | J36: of:=[.J35]+18 -> 602 | K36: of:=[.K35]+18 -> 603 | L36: of:=[.L35]+18 -> 604 | M36: of:=[.M35]+18 -> 605 | N36: of:=[.N35]+18 -> 606 | O36: of:=[.O35]+18 -> 607 | P36: of:=[.P35]+18 -> 608 | Q36: of:=[.Q35]+18 -> 609 | R36: of:=[.R35]+18 -> 610 | S36: of:=[.S35]+18 -> 611
A37: Cyl 34 | B37: of:=18+[.B36] -> 612 | C37: of:=18+[.C36] -> 613 | D37: of:=18+[.D36] -> 614 | E37: of:=18+[.E36] -> 615 | F37: of:=18+[.F36] -> 616 | G37: of:=18+[.G36] -> 617 | H37: of:=18+[.H36] -> 618 | I37: of:=18+[.I36] -> 619 | J37: of:=18+[.J36] -> 620 | K37: of:=18+[.K36] -> 621 | L37: of:=18+[.L36] -> 622 | M37: of:=18+[.M36] -> 623 | N37: of:=18+[.N36] -> 624 | O37: of:=18+[.O36] -> 625 | P37: of:=18+[.P36] -> 626 | Q37: of:=18+[.Q36] -> 627 | R37: of:=18+[.R36] -> 628 | S37: of:=18+[.S36] -> 629
A38: Cyl 35 | B38: of:=18+[.B37] -> 630 | C38: of:=18+[.C37] -> 631 | D38: of:=18+[.D37] -> 632 | E38: of:=18+[.E37] -> 633 | F38: of:=18+[.F37] -> 634 | G38: of:=18+[.G37] -> 635 | H38: of:=18+[.H37] -> 636 | I38: of:=18+[.I37] -> 637 | J38: of:=18+[.J37] -> 638 | K38: of:=18+[.K37] -> 639 | L38: of:=18+[.L37] -> 640 | M38: of:=18+[.M37] -> 641 | N38: of:=18+[.N37] -> 642 | O38: of:=18+[.O37] -> 643 | P38: of:=18+[.P37] -> 644 | Q38: of:=18+[.Q37] -> 645 | R38: of:=18+[.R37] -> 646 | S38: of:=18+[.S37] -> 647
A39: Cyl 36 | B39: of:=18+[.B38] -> 648 | C39: of:=18+[.C38] -> 649 | D39: of:=18+[.D38] -> 650 | E39: of:=18+[.E38] -> 651 | F39: of:=18+[.F38] -> 652 | G39: of:=18+[.G38] -> 653 | H39: of:=18+[.H38] -> 654 | I39: of:=18+[.I38] -> 655 | J39: of:=18+[.J38] -> 656 | K39: of:=18+[.K38] -> 657 | L39: of:=18+[.L38] -> 658 | M39: of:=18+[.M38] -> 659 | N39: of:=18+[.N38] -> 660 | O39: of:=18+[.O38] -> 661 | P39: of:=18+[.P38] -> 662 | Q39: of:=18+[.Q38] -> 663 | R39: of:=18+[.R38] -> 664 | S39: of:=18+[.S38] -> 665
A40: Cyl 37 | B40: of:=18+[.B39] -> 666 | C40: of:=18+[.C39] -> 667 | D40: of:=18+[.D39] -> 668 | E40: of:=18+[.E39] -> 669 | F40: of:=18+[.F39] -> 670 | G40: of:=18+[.G39] -> 671 | H40: of:=18+[.H39] -> 672 | I40: of:=18+[.I39] -> 673 | J40: of:=18+[.J39] -> 674 | K40: of:=18+[.K39] -> 675 | L40: of:=18+[.L39] -> 676 | M40: of:=18+[.M39] -> 677 | N40: of:=18+[.N39] -> 678 | O40: of:=18+[.O39] -> 679 | P40: of:=18+[.P39] -> 680 | Q40: of:=18+[.Q39] -> 681 | R40: of:=18+[.R39] -> 682 | S40: of:=18+[.S39] -> 683
A41: Cyl 38 | B41: of:=18+[.B40] -> 684 | C41: of:=18+[.C40] -> 685 | D41: of:=18+[.D40] -> 686 | E41: of:=18+[.E40] -> 687 | F41: of:=18+[.F40] -> 688 | G41: of:=18+[.G40] -> 689 | H41: of:=18+[.H40] -> 690 | I41: of:=18+[.I40] -> 691 | J41: of:=18+[.J40] -> 692 | K41: of:=18+[.K40] -> 693 | L41: of:=18+[.L40] -> 694 | M41: of:=18+[.M40] -> 695 | N41: of:=18+[.N40] -> 696 | O41: of:=18+[.O40] -> 697 | P41: of:=18+[.P40] -> 698 | Q41: of:=18+[.Q40] -> 699 | R41: of:=18+[.R40] -> 700 | S41: of:=18+[.S40] -> 701
A42: Cyl 39 | B42: of:=18+[.B41] -> 702 | C42: of:=18+[.C41] -> 703 | D42: of:=18+[.D41] -> 704 | E42: of:=18+[.E41] -> 705 | F42: of:=18+[.F41] -> 706 | G42: of:=18+[.G41] -> 707 | H42: of:=18+[.H41] -> 708 | I42: of:=18+[.I41] -> 709 | J42: of:=18+[.J41] -> 710 | K42: of:=18+[.K41] -> 711 | L42: of:=18+[.L41] -> 712 | M42: of:=18+[.M41] -> 713 | N42: of:=18+[.N41] -> 714 | O42: of:=18+[.O41] -> 715 | P42: of:=18+[.P41] -> 716 | Q42: of:=18+[.Q41] -> 717 | R42: of:=18+[.R41] -> 718 | S42: of:=18+[.S41] -> 719
B44: Note: | C44: LBA 494 only uses 128 bytes. | L44: Note: | M44: LBA 161 only uses 98 bytes.
C45: LBA 638 only uses 56 bytes | M45: LBA 377 only uses 372 bytes.
M46: LBA 665 only uses 98 bytes.

Sheet: Sheet2
A1: dd if=$SOURCE skip=foo bs=512 count=1 2>/dev/null | B1: of:=33*8 -> 264 | C1: 0 | D1: of:=[.C1]*8 -> 0 | E1: of:=[.$B$1]+[.C1] -> 264 | F1: of:=SUBSTITUTE([.$A$1];"foo";[.D1]) -> dd if=$SOURCE skip=0 bs=512 count=1 2>/dev/null | G1: of:=SUBSTITUTE([.$A$1];"foo";[.E1]) -> dd if=$SOURCE skip=264 bs=512 count=1 2>/dev/null | L1: of:=18+9 -> 27 | M1: 9 | N1: of:="dd if=/dev/zero bs=512 count=9 seek="&[.L1]&" of=$IMAGE conv=notrunc" -> dd if=/dev/zero bs=512 count=9 seek=27 of=$IMAGE conv=notrunc
C2: 1 | D2: of:=[.C2]*8 -> 8 | E2: of:=[.$B$1]+[.C2] -> 265 | F2: of:=SUBSTITUTE([.$A$1];"foo";[.D2]) -> dd if=$SOURCE skip=8 bs=512 count=1 2>/dev/null | G2: of:=SUBSTITUTE([.$A$1];"foo";[.E2]) -> dd if=$SOURCE skip=265 bs=512 count=1 2>/dev/null | L2: of:=[.L1]+18 -> 45 | M2: 9 | N2: of:="dd if=/dev/zero bs=512 count=9 seek="&[.L2]&" of=$IMAGE conv=notrunc" -> dd if=/dev/zero bs=512 count=9 seek=45 of=$IMAGE conv=notrunc
C3: 2 | D3: of:=[.C3]*8 -> 16 | E3: of:=[.$B$1]+[.C3] -> 266 | F3: of:=SUBSTITUTE([.$A$1];"foo";[.D3]) -> dd if=$SOURCE skip=16 bs=512 count=1 2>/dev/null | G3: of:=SUBSTITUTE([.$A$1];"foo";[.E3]) -> dd if=$SOURCE skip=266 bs=512 count=1 2>/dev/null | L3: of:=[.L2]+18 -> 63 | M3: 9 | N3: of:="dd if=/dev/zero bs=512 count=9 seek="&[.L3]&" of=$IMAGE conv=notrunc" -> dd if=/dev/zero bs=512 count=9 seek=63 of=$IMAGE conv=notrunc
C4: 3 | D4: of:=[.C4]*8 -> 24 | E4: of:=[.$B$1]+[.C4] -> 267 | F4: of:=SUBSTITUTE([.$A$1];"foo";[.D4]) -> dd if=$SOURCE skip=24 bs=512 count=1 2>/dev/null | G4: of:=SUBSTITUTE([.$A$1];"foo";[.E4]) -> dd if=$SOURCE skip=267 bs=512 count=1 2>/dev/null | L4: of:=[.L3]+18 -> 81 | M4: 9 | N4: of:="dd if=/dev/zero bs=512 count=9 seek="&[.L4]&" of=$IMAGE conv=notrunc" -> dd if=/dev/zero bs=512 count=9 seek=81 of=$IMAGE conv=notrunc
C5: 4 | D5: of:=[.C5]*8 -> 32 | E5: of:=[.$B$1]+[.C5] -> 268 | F5: of:=SUBSTITUTE([.$A$1];"foo";[.D5]) -> dd if=$SOURCE skip=32 bs=512 count=1 2>/dev/null | G5: of:=SUBSTITUTE([.$A$1];"foo";[.E5]) -> dd if=$SOURCE skip=268 bs=512 count=1 2>/dev/null | L5: of:=[.L4]+18 -> 99 | M5: 9 | N5: of:="dd if=/dev/zero bs=512 count=9 seek="&[.L5]&" of=$IMAGE conv=notrunc" -> dd if=/dev/zero bs=512 count=9 seek=99 of=$IMAGE conv=notrunc
C6: 5 | D6: of:=[.C6]*8 -> 40 | E6: of:=[.$B$1]+[.C6] -> 269 | F6: of:=SUBSTITUTE([.$A$1];"foo";[.D6]) -> dd if=$SOURCE skip=40 bs=512 count=1 2>/dev/null | G6: of:=SUBSTITUTE([.$A$1];"foo";[.E6]) -> dd if=$SOURCE skip=269 bs=512 count=1 2>/dev/null | L6: of:=[.L5]+18 -> 117 | M6: 9 | N6: of:="dd if=/dev/zero bs=512 count=9 seek="&[.L6]&" of=$IMAGE conv=notrunc" -> dd if=/dev/zero bs=512 count=9 seek=117 of=$IMAGE conv=notrunc
C7: 6 | D7: of:=[.C7]*8 -> 48 | E7: of:=[.$B$1]+[.C7] -> 270 | F7: of:=SUBSTITUTE([.$A$1];"foo";[.D7]) -> dd if=$SOURCE skip=48 bs=512 count=1 2>/dev/null | G7: of:=SUBSTITUTE([.$A$1];"foo";[.E7]) -> dd if=$SOURCE skip=270 bs=512 count=1 2>/dev/null | L7: of:=[.L6]+18 -> 135 | M7: 9 | N7: of:="dd if=/dev/zero bs=512 count=9 seek="&[.L7]&" of=$IMAGE conv=notrunc" -> dd if=/dev/zero bs=512 count=9 seek=135 of=$IMAGE conv=notrunc
C8: 7 | D8: of:=[.C8]*8 -> 56 | E8: of:=[.$B$1]+[.C8] -> 271 | F8: of:=SUBSTITUTE([.$A$1];"foo";[.D8]) -> dd if=$SOURCE skip=56 bs=512 count=1 2>/dev/null | G8: of:=SUBSTITUTE([.$A$1];"foo";[.E8]) -> dd if=$SOURCE skip=271 bs=512 count=1 2>/dev/null | L8: of:=[.L7]+18 -> 153 | M8: 9 | N8: of:="dd if=/dev/zero bs=512 count=9 seek="&[.L8]&" of=$IMAGE conv=notrunc" -> dd if=/dev/zero bs=512 count=9 seek=153 of=$IMAGE conv=notrunc
C9: 8 | D9: of:=[.C9]*8 -> 64 | E9: of:=[.$B$1]+[.C9] -> 272 | F9: of:=SUBSTITUTE([.$A$1];"foo";[.D9]) -> dd if=$SOURCE skip=64 bs=512 count=1 2>/dev/null | G9: of:=SUBSTITUTE([.$A$1];"foo";[.E9]) -> dd if=$SOURCE skip=272 bs=512 count=1 2>/dev/null | L9: of:=[.L8]+18 -> 171 | M9: 9 | N9: of:="dd if=/dev/zero bs=512 count=9 seek="&[.L9]&" of=$IMAGE conv=notrunc" -> dd if=/dev/zero bs=512 count=9 seek=171 of=$IMAGE conv=notrunc
C10: 9 | D10: of:=[.C10]*8 -> 72 | E10: of:=[.$B$1]+[.C10] -> 273 | F10: of:=SUBSTITUTE([.$A$1];"foo";[.D10]) -> dd if=$SOURCE skip=72 bs=512 count=1 2>/dev/null | G10: of:=SUBSTITUTE([.$A$1];"foo";[.E10]) -> dd if=$SOURCE skip=273 bs=512 count=1 2>/dev/null | L10: of:=[.L9]+18 -> 189 | M10: 9 | N10: of:="dd if=/dev/zero bs=512 count=9 seek="&[.L10]&" of=$IMAGE conv=notrunc" -> dd if=/dev/zero bs=512 count=9 seek=189 of=$IMAGE conv=notrunc
C11: 10 | D11: of:=[.C11]*8 -> 80 | E11: of:=[.$B$1]+[.C11] -> 274 | F11: of:=SUBSTITUTE([.$A$1];"foo";[.D11]) -> dd if=$SOURCE skip=80 bs=512 count=1 2>/dev/null | G11: of:=SUBSTITUTE([.$A$1];"foo";[.E11]) -> dd if=$SOURCE skip=274 bs=512 count=1 2>/dev/null | L11: of:=[.L10]+18 -> 207 | M11: 9 | N11: of:="dd if=/dev/zero bs=512 count=9 seek="&[.L11]&" of=$IMAGE conv=notrunc" -> dd if=/dev/zero bs=512 count=9 seek=207 of=$IMAGE conv=notrunc
C12: 11 | D12: of:=[.C12]*8 -> 88 | E12: of:=[.$B$1]+[.C12] -> 275 | F12: of:=SUBSTITUTE([.$A$1];"foo";[.D12]) -> dd if=$SOURCE skip=88 bs=512 count=1 2>/dev/null | G12: of:=SUBSTITUTE([.$A$1];"foo";[.E12]) -> dd if=$SOURCE skip=275 bs=512 count=1 2>/dev/null | L12: of:=[.L11]+18 -> 225 | M12: 9 | N12: of:="dd if=/dev/zero bs=512 count=9 seek="&[.L12]&" of=$IMAGE conv=notrunc" -> dd if=/dev/zero bs=512 count=9 seek=225 of=$IMAGE conv=notrunc
C13: 12 | D13: of:=[.C13]*8 -> 96 | E13: of:=[.$B$1]+[.C13] -> 276 | F13: of:=SUBSTITUTE([.$A$1];"foo";[.D13]) -> dd if=$SOURCE skip=96 bs=512 count=1 2>/dev/null | G13: of:=SUBSTITUTE([.$A$1];"foo";[.E13]) -> dd if=$SOURCE skip=276 bs=512 count=1 2>/dev/null | L13: of:=[.L12]+18 -> 243 | M13: 9 | N13: of:="dd if=/dev/zero bs=512 count=9 seek="&[.L13]&" of=$IMAGE conv=notrunc" -> dd if=/dev/zero bs=512 count=9 seek=243 of=$IMAGE conv=notrunc
C14: 13 | D14: of:=[.C14]*8 -> 104 | E14: of:=[.$B$1]+[.C14] -> 277 | F14: of:=SUBSTITUTE([.$A$1];"foo";[.D14]) -> dd if=$SOURCE skip=104 bs=512 count=1 2>/dev/null | G14: of:=SUBSTITUTE([.$A$1];"foo";[.E14]) -> dd if=$SOURCE skip=277 bs=512 count=1 2>/dev/null | L14: of:=[.L13]+18 -> 261 | M14: 9 | N14: of:="dd if=/dev/zero bs=512 count=9 seek="&[.L14]&" of=$IMAGE conv=notrunc" -> dd if=/dev/zero bs=512 count=9 seek=261 of=$IMAGE conv=notrunc
C15: 14 | D15: of:=[.C15]*8 -> 112 | E15: of:=[.$B$1]+[.C15] -> 278 | F15: of:=SUBSTITUTE([.$A$1];"foo";[.D15]) -> dd if=$SOURCE skip=112 bs=512 count=1 2>/dev/null | G15: of:=SUBSTITUTE([.$A$1];"foo";[.E15]) -> dd if=$SOURCE skip=278 bs=512 count=1 2>/dev/null | L15: of:=[.L14]+18 -> 279 | M15: 9 | N15: of:="dd if=/dev/zero bs=512 count=9 seek="&[.L15]&" of=$IMAGE conv=notrunc" -> dd if=/dev/zero bs=512 count=9 seek=279 of=$IMAGE conv=notrunc
C16: 15 | D16: of:=[.C16]*8 -> 120 | E16: of:=[.$B$1]+[.C16] -> 279 | F16: of:=SUBSTITUTE([.$A$1];"foo";[.D16]) -> dd if=$SOURCE skip=120 bs=512 count=1 2>/dev/null | G16: of:=SUBSTITUTE([.$A$1];"foo";[.E16]) -> dd if=$SOURCE skip=279 bs=512 count=1 2>/dev/null | L16: of:=[.L15]+18 -> 297 | M16: 9 | N16: of:="dd if=/dev/zero bs=512 count=9 seek="&[.L16]&" of=$IMAGE conv=notrunc" -> dd if=/dev/zero bs=512 count=9 seek=297 of=$IMAGE conv=notrunc
C17: 16 | D17: of:=[.C17]*8 -> 128 | E17: of:=[.$B$1]+[.C17] -> 280 | F17: of:=SUBSTITUTE([.$A$1];"foo";[.D17]) -> dd if=$SOURCE skip=128 bs=512 count=1 2>/dev/null | G17: of:=SUBSTITUTE([.$A$1];"foo";[.E17]) -> dd if=$SOURCE skip=280 bs=512 count=1 2>/dev/null | L17: of:=[.L16]+18 -> 315 | M17: 9 | N17: of:="dd if=/dev/zero bs=512 count=9 seek="&[.L17]&" of=$IMAGE conv=notrunc" -> dd if=/dev/zero bs=512 count=9 seek=315 of=$IMAGE conv=notrunc
C18: 17 | D18: of:=[.C18]*8 -> 136 | E18: of:=[.$B$1]+[.C18] -> 281 | F18: of:=SUBSTITUTE([.$A$1];"foo";[.D18]) -> dd if=$SOURCE skip=136 bs=512 count=1 2>/dev/null | G18: of:=SUBSTITUTE([.$A$1];"foo";[.E18]) -> dd if=$SOURCE skip=281 bs=512 count=1 2>/dev/null | L18: of:=[.L17]+18 -> 333 | M18: 9 | N18: of:="dd if=/dev/zero bs=512 count=9 seek="&[.L18]&" of=$IMAGE conv=notrunc" -> dd if=/dev/zero bs=512 count=9 seek=333 of=$IMAGE conv=notrunc
C19: 18 | D19: of:=[.C19]*8 -> 144 | E19: of:=[.$B$1]+[.C19] -> 282 | F19: of:=SUBSTITUTE([.$A$1];"foo";[.D19]) -> dd if=$SOURCE skip=144 bs=512 count=1 2>/dev/null | G19: of:=SUBSTITUTE([.$A$1];"foo";[.E19]) -> dd if=$SOURCE skip=282 bs=512 count=1 2>/dev/null | L19: of:=[.L18]+18 -> 351 | M19: 9 | N19: of:="dd if=/dev/zero bs=512 count=9 seek="&[.L19]&" of=$IMAGE conv=notrunc" -> dd if=/dev/zero bs=512 count=9 seek=351 of=$IMAGE conv=notrunc
C20: 19 | D20: of:=[.C20]*8 -> 152 | E20: of:=[.$B$1]+[.C20] -> 283 | F20: of:=SUBSTITUTE([.$A$1];"foo";[.D20]) -> dd if=$SOURCE skip=152 bs=512 count=1 2>/dev/null | G20: of:=SUBSTITUTE([.$A$1];"foo";[.E20]) -> dd if=$SOURCE skip=283 bs=512 count=1 2>/dev/null | L20: of:=[.L19]+18 -> 369 | M20: 9 | N20: of:="dd if=/dev/zero bs=512 count=9 seek="&[.L20]&" of=$IMAGE conv=notrunc" -> dd if=/dev/zero bs=512 count=9 seek=369 of=$IMAGE conv=notrunc
C21: 20 | D21: of:=[.C21]*8 -> 160 | E21: of:=[.$B$1]+[.C21] -> 284 | F21: of:=SUBSTITUTE([.$A$1];"foo";[.D21]) -> dd if=$SOURCE skip=160 bs=512 count=1 2>/dev/null | G21: of:=SUBSTITUTE([.$A$1];"foo";[.E21]) -> dd if=$SOURCE skip=284 bs=512 count=1 2>/dev/null | L21: of:=[.L20]+18 -> 387 | M21: 9 | N21: of:="dd if=/dev/zero bs=512 count=9 seek="&[.L21]&" of=$IMAGE conv=notrunc" -> dd if=/dev/zero bs=512 count=9 seek=387 of=$IMAGE conv=notrunc
C22: 21 | D22: of:=[.C22]*8 -> 168 | E22: of:=[.$B$1]+[.C22] -> 285 | F22: of:=SUBSTITUTE([.$A$1];"foo";[.D22]) -> dd if=$SOURCE skip=168 bs=512 count=1 2>/dev/null | G22: of:=SUBSTITUTE([.$A$1];"foo";[.E22]) -> dd if=$SOURCE skip=285 bs=512 count=1 2>/dev/null | L22: of:=[.L21]+18 -> 405 | M22: 9 | N22: of:="dd if=/dev/zero bs=512 count=9 seek="&[.L22]&" of=$IMAGE conv=notrunc" -> dd if=/dev/zero bs=512 count=9 seek=405 of=$IMAGE conv=notrunc
C23: 22 | D23: of:=[.C23]*8 -> 176 | E23: of:=[.$B$1]+[.C23] -> 286 | F23: of:=SUBSTITUTE([.$A$1];"foo";[.D23]) -> dd if=$SOURCE skip=176 bs=512 count=1 2>/dev/null | G23: of:=SUBSTITUTE([.$A$1];"foo";[.E23]) -> dd if=$SOURCE skip=286 bs=512 count=1 2>/dev/null | L23: of:=[.L22]+18 -> 423 | M23: 9 | N23: of:="dd if=/dev/zero bs=512 count=9 seek="&[.L23]&" of=$IMAGE conv=notrunc" -> dd if=/dev/zero bs=512 count=9 seek=423 of=$IMAGE conv=notrunc
C24: 23 | D24: of:=[.C24]*8 -> 184 | E24: of:=[.$B$1]+[.C24] -> 287 | F24: of:=SUBSTITUTE([.$A$1];"foo";[.D24]) -> dd if=$SOURCE skip=184 bs=512 count=1 2>/dev/null | G24: of:=SUBSTITUTE([.$A$1];"foo";[.E24]) -> dd if=$SOURCE skip=287 bs=512 count=1 2>/dev/null | L24: of:=[.L23]+18 -> 441 | M24: 9 | N24: of:="dd if=/dev/zero bs=512 count=9 seek="&[.L24]&" of=$IMAGE conv=notrunc" -> dd if=/dev/zero bs=512 count=9 seek=441 of=$IMAGE conv=notrunc
C25: 24 | D25: of:=[.C25]*8 -> 192 | E25: of:=[.$B$1]+[.C25] -> 288 | F25: of:=SUBSTITUTE([.$A$1];"foo";[.D25]) -> dd if=$SOURCE skip=192 bs=512 count=1 2>/dev/null | G25: of:=SUBSTITUTE([.$A$1];"foo";[.E25]) -> dd if=$SOURCE skip=288 bs=512 count=1 2>/dev/null | L25: of:=[.L24]+18 -> 459 | M25: 9 | N25: of:="dd if=/dev/zero bs=512 count=9 seek="&[.L25]&" of=$IMAGE conv=notrunc" -> dd if=/dev/zero bs=512 count=9 seek=459 of=$IMAGE conv=notrunc
C26: 25 | D26: of:=[.C26]*8 -> 200 | E26: of:=[.$B$1]+[.C26] -> 289 | F26: of:=SUBSTITUTE([.$A$1];"foo";[.D26]) -> dd if=$SOURCE skip=200 bs=512 count=1 2>/dev/null | G26: of:=SUBSTITUTE([.$A$1];"foo";[.E26]) -> dd if=$SOURCE skip=289 bs=512 count=1 2>/dev/null | L26: of:=[.L25]+18 -> 477 | M26: 9 | N26: of:="dd if=/dev/zero bs=512 count=9 seek="&[.L26]&" of=$IMAGE conv=notrunc" -> dd if=/dev/zero bs=512 count=9 seek=477 of=$IMAGE conv=notrunc
C27: 26 | D27: of:=[.C27]*8 -> 208 | E27: of:=[.$B$1]+[.C27] -> 290 | F27: of:=SUBSTITUTE([.$A$1];"foo";[.D27]) -> dd if=$SOURCE skip=208 bs=512 count=1 2>/dev/null | G27: Last 128 bytes | L27: of:=[.L26]+18 -> 495 | M27: 9 | N27: of:="dd if=/dev/zero bs=512 count=9 seek="&[.L27]&" of=$IMAGE conv=notrunc" -> dd if=/dev/zero bs=512 count=9 seek=495 of=$IMAGE conv=notrunc
C28: 27 | D28: of:=[.C28]*8 -> 216 | F28: of:=SUBSTITUTE([.$A$1];"foo";[.D28]) -> dd if=$SOURCE skip=216 bs=512 count=1 2>/dev/null | L28: of:=[.L27]+18 -> 513 | M28: 9 | N28: of:="dd if=/dev/zero bs=512 count=9 seek="&[.L28]&" of=$IMAGE conv=notrunc" -> dd if=/dev/zero bs=512 count=9 seek=513 of=$IMAGE conv=notrunc
C29: 28 | D29: of:=[.C29]*8 -> 224 | F29: of:=SUBSTITUTE([.$A$1];"foo";[.D29]) -> dd if=$SOURCE skip=224 bs=512 count=1 2>/dev/null | L29: of:=[.L28]+18 -> 531 | M29: 9 | N29: of:="dd if=/dev/zero bs=512 count=9 seek="&[.L29]&" of=$IMAGE conv=notrunc" -> dd if=/dev/zero bs=512 count=9 seek=531 of=$IMAGE conv=notrunc
C30: 29 | D30: of:=[.C30]*8 -> 232 | F30: of:=SUBSTITUTE([.$A$1];"foo";[.D30]) -> dd if=$SOURCE skip=232 bs=512 count=1 2>/dev/null | L30: of:=[.L29]+18 -> 549 | M30: 9 | N30: of:="dd if=/dev/zero bs=512 count=9 seek="&[.L30]&" of=$IMAGE conv=notrunc" -> dd if=/dev/zero bs=512 count=9 seek=549 of=$IMAGE conv=notrunc
C31: 30 | D31: of:=[.C31]*8 -> 240 | F31: of:=SUBSTITUTE([.$A$1];"foo";[.D31]) -> dd if=$SOURCE skip=240 bs=512 count=1 2>/dev/null | L31: of:=[.L30]+18 -> 567 | M31: 9 | N31: of:="dd if=/dev/zero bs=512 count=9 seek="&[.L31]&" of=$IMAGE conv=notrunc" -> dd if=/dev/zero bs=512 count=9 seek=567 of=$IMAGE conv=notrunc
C32: 31 | D32: of:=[.C32]*8 -> 248 | F32: of:=SUBSTITUTE([.$A$1];"foo";[.D32]) -> dd if=$SOURCE skip=248 bs=512 count=1 2>/dev/null | L32: of:=[.L31]+18 -> 585 | M32: 9 | N32: of:="dd if=/dev/zero bs=512 count=9 seek="&[.L32]&" of=$IMAGE conv=notrunc" -> dd if=/dev/zero bs=512 count=9 seek=585 of=$IMAGE conv=notrunc
C33: 32 | D33: of:=[.C33]*8 -> 256 | F33: of:=SUBSTITUTE([.$A$1];"foo";[.D33]) -> dd if=$SOURCE skip=256 bs=512 count=1 2>/dev/null | L33: of:=[.L32]+18 -> 603 | M33: 9 | N33: of:="dd if=/dev/zero bs=512 count=9 seek="&[.L33]&" of=$IMAGE conv=notrunc" -> dd if=/dev/zero bs=512 count=9 seek=603 of=$IMAGE conv=notrunc
L34: of:=[.L33]+18 -> 621 | M34: 9 | N34: of:="dd if=/dev/zero bs=512 count=9 seek="&[.L34]&" of=$IMAGE conv=notrunc" -> dd if=/dev/zero bs=512 count=9 seek=621 of=$IMAGE conv=notrunc
L35: of:=[.L34]+18 -> 639 | M35: 9 | N35: of:="dd if=/dev/zero bs=512 count=9 seek="&[.L35]&" of=$IMAGE conv=notrunc" -> dd if=/dev/zero bs=512 count=9 seek=639 of=$IMAGE conv=notrunc
L36: of:=[.L35]+18 -> 657 | M36: 9 | N36: of:="dd if=/dev/zero bs=512 count=9 seek="&[.L36]&" of=$IMAGE conv=notrunc" -> dd if=/dev/zero bs=512 count=9 seek=657 of=$IMAGE conv=notrunc
L37: of:=[.L36]+18 -> 675 | M37: 9 | N37: of:="dd if=/dev/zero bs=512 count=9 seek="&[.L37]&" of=$IMAGE conv=notrunc" -> dd if=/dev/zero bs=512 count=9 seek=675 of=$IMAGE conv=notrunc
L38: of:=[.L37]+18 -> 693 | M38: 9 | N38: of:="dd if=/dev/zero bs=512 count=9 seek="&[.L38]&" of=$IMAGE conv=notrunc" -> dd if=/dev/zero bs=512 count=9 seek=693 of=$IMAGE conv=notrunc
L39: of:=[.L38]+18 -> 711 | M39: 9 | N39: of:="dd if=/dev/zero bs=512 count=9 seek="&[.L39]&" of=$IMAGE conv=notrunc" -> dd if=/dev/zero bs=512 count=9 seek=711 of=$IMAGE conv=notrunc